[
  {
    "id": "hornady-varminatorexpress-224-69",
    "manufacturer": "Hornady",
    "name": "Varminator Express",
    "caliber": 0.224,
    "caliberMm": 5.6896,
    "weight": 69,
    "weightMetric": 4.47112,
    "sd": 0.123,
    "bc1": 0.11,
    "bc7": 0.22,
    "type": "centerfire"
  },
  {
    "id": "hornady-varminatorexpress-224-55",
    "manufacturer": "Hornady",
    "name": "Varminator Express",
    "caliber": 0.224,
    "caliberMm": 5.6896,
    "weight": 55,
    "weightMetric": 3.56394,
    "sd": 0.234,
    "bc1": 0.12,
    "bc7": 0.23,
    "type": "centerfire"
  },
  {
    "id": "hornady-varminatorexpress-224-40",
    "manufacturer": "Hornady",
    "name": "Varminator Express",
    "caliber": 0.224,
    "caliberMm": 5.6896,
    "weight": 40,
    "weightMetric": 2.59196,
    "sd": 0.345,
    "bc1": 0.13,
    "bc7": 0.24,
    "type": "centerfire"
  }
]